{
  "schema_version": "aionis_soak_workload_manifest_v1",
  "frozen_at": "2026-07-20T14:05:00.000Z",
  "groups": [
    "baseline",
    "long_context",
    "aionis"
  ],
  "scenarios": [
    "branch_recovery",
    "negative_transfer",
    "summary_only_inspect"
  ],
  "product_invariants": [
    "golden_product_loop",
    "product_loop",
    "ordinary_memory_loop",
    "single_agent_loop",
    "multi_agent_loop"
  ],
  "pilot": {
    "repetitions_per_cell": 1,
    "semantic_chat_calls": 9,
    "aionis_trials": 3
  },
  "soak": {
    "repetitions_per_cell_per_wave": 3,
    "semantic_chat_calls": 81,
    "waves": 3,
    "semantic_chat_calls_per_wave": 27,
    "aionis_trials_per_wave": 9,
    "total_aionis_trials": 27,
    "negative_transfer_trials": 9
  },
  "verifier": {
    "real_tools": true,
    "deterministic_outcome_verifier": true,
    "model_self_report_accepted": false
  },
  "recovery": {
    "after_wave_1": "graceful_replacement",
    "after_wave_2": "sigkill_replacement",
    "after_wave_3": "offline_sqlite_verify"
  }
}
